{
  "counts": {
    "dispatch": 0,
    "mutations": 0,
    "search": 0
  },
  "currency": "EUR",
  "native_refs": {
    "import_ref": {
      "file": "import_candidate.json",
      "id": "g5import:e4c98b7b825b2ca23e2f1457faf3af57d760bb613b78a24973a78aef9d843181"
    },
    "offer": {
      "file": "offer_body.json",
      "id": "source:football:fdfbfa8f9a23d97365f4041e379d06028ae2238b099236d2b5b875adcffa2e00"
    },
    "requester_review": {
      "file": "requester_review.json",
      "id": "fd94ecffefa21206b5a28bf93f0aa487ea562cbcfaeb9fc7ae141d0062c84ba1"
    },
    "requester_work": {
      "file": "requester_work.json",
      "id": "work_results:2021ea634fd24423fcb8aa95cb4ffc076edf6bd9590069eefc3a179807765781"
    }
  },
  "operation": "CONFIRM_MOCK_BOOKING",
  "receipt_ref": "effect_receipt_v01:16d2611a5c85f250f59ad56e38cca6ce24922af4f56efe3b0791169ce30c2966",
  "request_ref": "request:exam:one",
  "request_revision": 2,
  "slots": [
    {
      "end_utc": 1799341200,
      "field_id": "field:elm",
      "price_minor": 2100,
      "session_id": "session:7",
      "start_utc": 1799335800,
      "venue_ref": "venue:synthetic"
    },
    {
      "end_utc": 1799409600,
      "field_id": "field:elm",
      "price_minor": 2100,
      "session_id": "session:8",
      "start_utc": 1799404200,
      "venue_ref": "venue:synthetic"
    },
    {
      "end_utc": 1799494200,
      "field_id": "field:elm",
      "price_minor": 2100,
      "session_id": "session:9",
      "start_utc": 1799488800,
      "venue_ref": "venue:synthetic"
    }
  ],
  "source": {
    "observed_at": 1790326469,
    "offer_revision": 4,
    "pt": 1790326469,
    "publisher": "VenueRoot",
    "recipient": "ActivePlanetRoot",
    "request_revision": 2,
    "schedule_revision": 4,
    "status": "ACTIVE",
    "status_checked": 1790326470,
    "status_until": 1790326530,
    "ttl": 300,
    "valid_from": 1790326469,
    "valid_to": 1790326769
  },
  "status": "MOCK_BOOKED",
  "team_ref": "team:one",
  "total_minor": 6300,
  "version": "g53.result.v01"
}
